<?xml version="1.0" encoding="UTF-8"?>
<issues  xmlns:xsi="http://www.w3.org/2001/XMLSchema-instance" xsi:noNamespaceSchemaLocation="xsd/Issues.xsd">
	<issue id="1">
		<priority-id>1</priority-id>
		<assignee-id>1</assignee-id>
		<type-id>1</type-id>
		<status-id>1</status-id>
		<summary>bug 0</summary>
		<description>some info about bug 0</description>
		<project-id>1</project-id>
		<build-found-id>1</build-found-id>
		<create-date>2014-04-25</create-date>
		<created-by-id>0</created-by-id>
	</issue>
</issues>